1,comment,0.4336283185840708,0.5962957533108537,254,41,jkgfkyf,hgy,2024-09-04 17:02:16,,deleted
1,comment,0.544839255499154,0.7965875907579113,286,48,g g  g g g g g g g g g g g g g g g g g g g g g g g g ,m,2024-09-30 14:35:21,,deleted
1,comment,0.46573604060913704,0.6475284735026599,286,48,g g g g g g g g g g g g g g g g g g g g g g g g g,m,2024-09-30 15:00:06,,active
1,comment,0.5723350253807107,0.6876163421584283,286,48,g g g g g g g g g g g g g g g g g g g g g g g g g,m,2024-09-30 15:06:30,,active
1,comment,0.5132275132275133,0.6917276619251485,179,61,ff f f f f f f f f f f f f f f f f f f f f f f f f,m,2024-09-30 15:26:15,,active
1,comment,0.656084656084656,0.7412235879022234,148,61,b b b b b b b b b b b b b b b b b b b b b b b b b,m,2024-09-30 16:33:22,,active
1,comment,0.455026455026455,0.7235464714818395,202,61,b b b b b b b b b b b b b b b b b b b b b b b bb b,m,2024-09-30 16:37:01,,active
1,comment,0.5661375661375662,0.7359204529761083,158,61,v v v v v v v v v v v v v v v v v v v v v v v v v,m,2024-09-30 16:39:34,,active
1,comment,0.5909475465313029,0.8417570202291995,286,48,b b b b b b b b b b b b b b b b b b b b b b b b b ,m,2024-09-30 16:45:07,,deleted
